{
  "$schema": "https://json-schema.org/draft/2020-12/schema",
  "$id": "https://brullik.github.io/hermes-software-factory/schemas/task-contract.schema.json",
  "title": "Task Contract",
  "type": "object",
  "additionalProperties": false,
  "required": [
    "schema_version",
    "artifact_id",
    "product_id",
    "created_at",
    "producer",
    "policy_digest",
    "task_id",
    "title",
    "objective",
    "dependencies",
    "conflict_keys",
    "allowed_paths",
    "forbidden_paths",
    "acceptance",
    "risk_tier",
    "complexity_features",
    "model_floor",
    "rollback",
    "status"
  ],
  "properties": {
    "schema_version": {
      "type": "string",
      "const": "1.0"
    },
    "artifact_id": {
      "type": "string",
      "minLength": 8
    },
    "product_id": {
      "type": "string",
      "minLength": 8
    },
    "created_at": {
      "type": "string",
      "format": "date-time"
    },
    "producer": {
      "type": "object",
      "additionalProperties": false,
      "required": [
        "role",
        "tier"
      ],
      "properties": {
        "role": {
          "type": "string",
          "minLength": 1
        },
        "tier": {
          "type": "string",
          "enum": [
            "deterministic",
            "luna",
            "terra",
            "sol"
          ]
        },
        "provider": {
          "type": [
            "string",
            "null"
          ]
        },
        "model": {
          "type": [
            "string",
            "null"
          ]
        }
      }
    },
    "policy_digest": {
      "type": "string",
      "pattern": "^[a-f0-9]{64}$"
    },
    "task_id": {
      "type": "string",
      "pattern": "^T-[A-Z0-9_-]{4,}$"
    },
    "title": {
      "type": "string",
      "minLength": 1
    },
    "objective": {
      "type": "string",
      "minLength": 10
    },
    "dependencies": {
      "type": "array",
      "items": {
        "type": "string"
      },
      "uniqueItems": true
    },
    "conflict_keys": {
      "type": "array",
      "items": {
        "type": "string"
      },
      "uniqueItems": true
    },
    "allowed_paths": {
      "type": "array",
      "minItems": 1,
      "items": {
        "type": "string",
        "minLength": 1
      }
    },
    "forbidden_paths": {
      "type": "array",
      "items": {
        "type": "string",
        "minLength": 1
      }
    },
    "acceptance": {
      "type": "array",
      "minItems": 1,
      "items": {
        "type": "object",
        "additionalProperties": false,
        "required": [
          "criterion_id",
          "verification",
          "mandatory"
        ],
        "properties": {
          "criterion_id": {
            "type": "string",
            "minLength": 1
          },
          "verification": {
            "type": "string",
            "minLength": 1
          },
          "mandatory": {
            "type": "boolean"
          }
        }
      }
    },
    "risk_tier": {
      "type": "string",
      "enum": [
        "low",
        "medium",
        "high"
      ]
    },
    "complexity_features": {
      "type": "array",
      "items": {
        "type": "string",
        "minLength": 1
      }
    },
    "model_floor": {
      "type": "string",
      "enum": [
        "deterministic",
        "luna",
        "terra",
        "sol"
      ]
    },
    "rollback": {
      "type": "string",
      "minLength": 1
    },
    "status": {
      "type": "string",
      "enum": [
        "ready",
        "blocked_dependency",
        "needs_replan"
      ]
    },
    "quality_gates": {
      "type": "array",
      "items": {
        "type": "string",
        "minLength": 1
      },
      "uniqueItems": true
    }
  }
}
